Ref,Species,Start,End,Duration,long,lat,locationDescription,Notes
Czenze & Willis 2015,MYLU,15-Sep,15-May,,53.12,-99.19,"Dale's Cave, ~ 50km N of Grand Rapids Manatoba",Males and females had different exit dats in this study. Averaged the two
Norwuay & Willis 2014,MYLU,13-Sep,15-May,,51.44,-9738,St. George bat cave near Fisher River First Nation (14u 613884 5700551),Point not found through google maps so I took the point from the Fisher River Cree Nation
Jonasson and Willis 2012,MYLU,15-Sep,15-May,,53.12,99.19,"Dale's Cave, ~ 50km N of Grand Rapids Manatoba",points are the same sa the first entry
"Reimer, Lausen & Barkley 2014",MYLU,15-Sep,15-May,,,,"Wood bufflow National Park, Walk-in cave",Not sure that this paper fully gives the data I want/need but it's what I 
Johnson et al 2016,MYLU,15-Oct,10-Apr,,44.93,-110.67,Yellowstone national park close to mamoth hotspings,point taken ~3-4 SW from center even with Bunsen peak. Temporal accuracy of data is questionable. 
"Brack and twente, 1985",MYLU,,,83,38.83,-92.29,Hunters cave Boone Country Missouri,"Data is sketchy, pont taken from where google maps droped me when entered into the search bar"
Hayman and Cryan 2017,MYLU,4-Dec,1-Apr,,36.61,-83.66,Gap Cave Va,point derived from the cumberland gap. 
